{
  "type": "object",
  "required": [
    "categories",
    "products",
    "query_type",
    "search_query_id"
  ],
  "$schema": "https://json-schema.org/draft/2020-12/schema",
  "properties": {
    "categories": {
      "type": "array",
      "items": {
        "type": "object",
        "required": [
          "id",
          "name",
          "parent_name",
          "type"
        ],
        "properties": {
          "id": {
            "type": "string",
            "enum": [
              "264C39231",
              "264C39180"
            ]
          },
          "main_name": {
            "type": "string",
            "enum": [
              "Основной каталог"
            ]
          },
          "name": {
            "type": "string",
            "j2sEnumRejected": true
          },
          "parent_id": {
            "type": "string",
            "enum": [
              "264C39228"
            ]
          },
          "parent_name": {
            "type": "string",
            "enum": [
              "Напитки",
              "Мясная гастрономия"
            ]
          },
          "type": {
            "type": "string",
            "enum": [
              "subcategory"
            ]
          }
        }
      }
    },
    "detail": {
      "type": "array",
      "items": {
        "type": "object",
        "required": [
          "ctx",
          "input",
          "loc",
          "msg",
          "type",
          "url"
        ],
        "properties": {
          "ctx": {
            "type": "object",
            "required": [
              "min_length"
            ],
            "properties": {
              "min_length": {
                "type": "integer"
              }
            }
          },
          "input": {
            "type": "string"
          },
          "loc": {
            "type": "array",
            "items": {
              "type": "string"
            }
          },
          "msg": {
            "type": "string"
          },
          "type": {
            "type": "string"
          },
          "url": {
            "type": "string",
            "format": "uri"
          }
        }
      }
    },
    "products": {
      "type": "array",
      "items": {
        "type": "object",
        "required": [
          "badges",
          "boost_type",
          "cpd_labels",
          "features",
          "has_age_restriction",
          "image_links",
          "initial_weight_step",
          "is_available",
          "is_large_card",
          "labels",
          "max_qty_per_order",
          "median_price",
          "min_weight",
          "name",
          "orange_loyalty_points",
          "plu",
          "price_piece_unit",
          "prices",
          "product_advert",
          "promo",
          "property_clarification",
          "rating",
          "step",
          "stickers",
          "stock_limit",
          "uom"
        ],
        "properties": {
          "badges": {
            "type": "array",
            "items": {}
          },
          "boost_type": {
            "type": "null"
          },
          "cpd_labels": {
            "type": "null"
          },
          "features": {
            "type": "null"
          },
          "has_age_restriction": {
            "type": "boolean"
          },
          "image_links": {
            "type": "object",
            "required": [
              "normal",
              "small"
            ],
            "properties": {
              "normal": {
                "type": "array",
                "items": {
                  "type": "string",
                  "format": "uri"
                }
              },
              "small": {
                "type": "array",
                "items": {
                  "type": "string",
                  "format": "uri"
                }
              }
            }
          },
          "initial_weight_step": {
            "type": "string",
            "j2sEnumRejected": true
          },
          "is_available": {
            "type": "boolean"
          },
          "is_large_card": {
            "type": "null"
          },
          "labels": {
            "type": "null"
          },
          "max_qty_per_order": {
            "type": "null"
          },
          "median_price": {
            "type": "null"
          },
          "min_weight": {
            "type": "string",
            "j2sEnumRejected": true
          },
          "name": {
            "type": "string",
            "j2sEnumRejected": true
          },
          "orange_loyalty_points": {
            "type": "integer"
          },
          "plu": {
            "type": "integer"
          },
          "price_piece_unit": {
            "type": "null"
          },
          "prices": {
            "type": "object",
            "required": [
              "cpd_promo_price",
              "cpd_promo_price_from_sum_cart",
              "discount",
              "regular"
            ],
            "properties": {
              "cpd_promo_price": {
                "type": "null"
              },
              "cpd_promo_price_from_sum_cart": {
                "type": "null"
              },
              "discount": {
                "type": "null"
              },
              "regular": {
                "type": "string",
                "j2sEnumRejected": true
              }
            }
          },
          "product_advert": {
            "type": "null"
          },
          "promo": {
            "type": "null"
          },
          "property_clarification": {
            "type": "string",
            "enum": [
              "1.5 л",
              "500 г",
              "250 г",
              "330 г",
              "50 г",
              "80 г",
              "70 г",
              "150 г",
              "1 л",
              "500 мл",
              "108 г"
            ]
          },
          "rating": {
            "anyOf": [
              {
                "type": "object",
                "required": [
                  "rates_count",
                  "rating_average"
                ],
                "properties": {
                  "rates_count": {
                    "type": "integer"
                  },
                  "rating_average": {
                    "type": "number"
                  }
                }
              },
              {
                "type": "null"
              }
            ]
          },
          "step": {
            "type": "string",
            "j2sEnumRejected": true
          },
          "stickers": {
            "type": "null"
          },
          "stock_limit": {
            "type": "string",
            "j2sEnumRejected": true
          },
          "uom": {
            "type": "string",
            "enum": [
              "шт"
            ]
          }
        }
      }
    },
    "query_type": {
      "type": "string",
      "enum": [
        "strict"
      ]
    },
    "search_query_id": {
      "type": "string",
      "format": "uuid"
    }
  }
}